[
  {
    "receipt_id": "8d9fb757-55be-4975-b208-26768f85ce26",
    "command_id": "5a1888df-a39d-4670-83ee-7ae51ad6b100",
    "status": "ACCEPTED",
    "recorded_at": "2026-10-07T00:07:04.575033Z",
    "event_ids": [
      "481be410-6726-440b-82f1-33f48e41696b"
    ],
    "result": {
      "pair": {
        "pair_id": "SKT-0900",
        "owner_org_id": "ORG-OWNER",
        "size_system": "US_MENS",
        "size_value": "8",
        "brand": null,
        "model": null,
        "category": "HOCKEY",
        "acquisition_date": null,
        "acquisition_source": null,
        "acquisition_cost_minor": null,
        "ownership_evidence_ref": null,
        "home_location_id": "LOC-RINK",
        "current_location_id": "LOC-RINK",
        "custodian_org_id": "ORG-OWNER",
        "availability_state": "MISSING_COMPONENT",
        "maintenance_state": "OK",
        "maintenance_flags": [],
        "lifecycle_state": "ACTIVE",
        "total_rental_cycles": 0,
        "estimated_use_minutes": 0,
        "last_inventory_verified_at": null,
        "version": 1,
        "created_at": "2026-10-07T00:07:04.577219Z",
        "updated_at": "2026-10-07T00:07:04.577219Z"
      }
    },
    "error": null
  },
  {
    "receipt_id": "42ac75f7-d768-4c0a-8da1-a9f678d54425",
    "command_id": "16699778-4e73-40ca-a88b-ef67643ce27b",
    "status": "ACCEPTED",
    "recorded_at": "2026-10-07T00:07:04.579027Z",
    "event_ids": [
      "bf46c224-a980-4b48-a8f2-38a28571492d"
    ],
    "result": {
      "component": {
        "component_id": "SKT-0900-L",
        "pair_id": "SKT-0900",
        "side": "L",
        "label_identifier": "SKT-0900-L",
        "serial_or_manufacturer_id": null,
        "blade_type": null,
        "component_condition": "GOOD",
        "current_location_id": "LOC-RINK",
        "last_seen_at": null,
        "replacement_of_component_id": null,
        "version": 1,
        "created_at": "2026-10-07T00:07:04.580227Z",
        "updated_at": "2026-10-07T00:07:04.580227Z"
      },
      "pair_version": 2
    },
    "error": null
  },
  {
    "receipt_id": "c8cf846a-4dea-41a7-a974-121eca615cc1",
    "command_id": "18277949-3f94-4835-a57f-740f1680e095",
    "status": "ACCEPTED",
    "recorded_at": "2026-10-07T00:07:04.581798Z",
    "event_ids": [
      "e47fe1f4-4c83-402d-b97a-2e1e75a1038c"
    ],
    "result": {
      "component": {
        "component_id": "SKT-0900-R",
        "pair_id": "SKT-0900",
        "side": "R",
        "label_identifier": "SKT-0900-R",
        "serial_or_manufacturer_id": null,
        "blade_type": null,
        "component_condition": "GOOD",
        "current_location_id": "LOC-RINK",
        "last_seen_at": null,
        "replacement_of_component_id": null,
        "version": 1,
        "created_at": "2026-10-07T00:07:04.582697Z",
        "updated_at": "2026-10-07T00:07:04.582697Z"
      },
      "pair_version": 3
    },
    "error": null
  },
  {
    "receipt_id": "92b64f64-03a5-4914-aadf-5a3aeec05cf9",
    "command_id": "81316bff-7a92-4fad-ab56-e27a1a9d4983",
    "status": "ACCEPTED",
    "recorded_at": "2026-10-07T00:07:04.584112Z",
    "event_ids": [
      "2e2f2a2f-2ccc-40d0-b2c5-a82034485803"
    ],
    "result": {
      "pair": {
        "pair_id": "SKT-0900",
        "owner_org_id": "ORG-OWNER",
        "size_system": "US_MENS",
        "size_value": "8",
        "brand": null,
        "model": null,
        "category": "HOCKEY",
        "acquisition_date": null,
        "acquisition_source": null,
        "acquisition_cost_minor": null,
        "ownership_evidence_ref": null,
        "home_location_id": "LOC-RINK",
        "current_location_id": "LOC-RINK",
        "custodian_org_id": "ORG-OWNER",
        "availability_state": "AVAILABLE",
        "maintenance_state": "OK",
        "lifecycle_state": "ACTIVE",
        "total_rental_cycles": 0,
        "estimated_use_minutes": 0,
        "last_inventory_verified_at": null,
        "version": 4,
        "created_at": "2026-10-07T00:07:04.577219Z",
        "updated_at": "2026-10-07T00:07:04.585513Z",
        "maintenance_flags": []
      }
    },
    "error": null
  },
  {
    "receipt_id": "a6abfc65-4194-4800-839f-108294662ec7",
    "command_id": "da417b62-3337-4f94-9409-7f6043047481",
    "status": "ACCEPTED",
    "recorded_at": "2026-10-07T00:07:04.586923Z",
    "event_ids": [
      "e65a875c-aa05-4dac-bc4b-759a21d7b7e7"
    ],
    "result": {
      "pair": {
        "pair_id": "SKT-0901",
        "owner_org_id": "ORG-OWNER",
        "size_system": "US_MENS",
        "size_value": "9",
        "brand": null,
        "model": null,
        "category": "HOCKEY",
        "acquisition_date": null,
        "acquisition_source": null,
        "acquisition_cost_minor": null,
        "ownership_evidence_ref": null,
        "home_location_id": "LOC-RINK",
        "current_location_id": "LOC-RINK",
        "custodian_org_id": "ORG-OWNER",
        "availability_state": "MISSING_COMPONENT",
        "maintenance_state": "OK",
        "maintenance_flags": [],
        "lifecycle_state": "ACTIVE",
        "total_rental_cycles": 0,
        "estimated_use_minutes": 0,
        "last_inventory_verified_at": null,
        "version": 1,
        "created_at": "2026-10-07T00:07:04.588024Z",
        "updated_at": "2026-10-07T00:07:04.588024Z"
      }
    },
    "error": null
  },
  {
    "receipt_id": "8541d03f-8846-44f1-92e3-f36de692410d",
    "command_id": "b1007b39-16b2-4fe8-9589-7e292d4fa7ef",
    "status": "ACCEPTED",
    "recorded_at": "2026-10-07T00:07:04.589892Z",
    "event_ids": [
      "b2061b8f-d325-4cdf-be17-188715f8d6e2"
    ],
    "result": {
      "component": {
        "component_id": "SKT-0901-L",
        "pair_id": "SKT-0901",
        "side": "L",
        "label_identifier": "SKT-0901-L",
        "serial_or_manufacturer_id": null,
        "blade_type": null,
        "component_condition": "GOOD",
        "current_location_id": "LOC-RINK",
        "last_seen_at": null,
        "replacement_of_component_id": null,
        "version": 1,
        "created_at": "2026-10-07T00:07:04.590858Z",
        "updated_at": "2026-10-07T00:07:04.590858Z"
      },
      "pair_version": 2
    },
    "error": null
  },
  {
    "receipt_id": "d200cbac-0b11-4796-b112-e51f62dc6ad1",
    "command_id": "72b81bce-7e99-4342-a535-945310438745",
    "status": "ACCEPTED",
    "recorded_at": "2026-10-07T00:07:04.592352Z",
    "event_ids": [
      "99d39e51-8710-477e-8375-8750f87285e3"
    ],
    "result": {
      "component": {
        "component_id": "SKT-0901-R",
        "pair_id": "SKT-0901",
        "side": "R",
        "label_identifier": "SKT-0901-R",
        "serial_or_manufacturer_id": null,
        "blade_type": null,
        "component_condition": "GOOD",
        "current_location_id": "LOC-RINK",
        "last_seen_at": null,
        "replacement_of_component_id": null,
        "version": 1,
        "created_at": "2026-10-07T00:07:04.593472Z",
        "updated_at": "2026-10-07T00:07:04.593472Z"
      },
      "pair_version": 3
    },
    "error": null
  },
  {
    "receipt_id": "bcc7d6f3-34eb-495f-b74a-057dc0322064",
    "command_id": "e05b58e1-baa5-4faf-94bf-55e74ea6f981",
    "status": "ACCEPTED",
    "recorded_at": "2026-10-07T00:07:04.594938Z",
    "event_ids": [
      "0de99f68-01e8-4e12-82fd-ee30c2ba2c2b"
    ],
    "result": {
      "pair": {
        "pair_id": "SKT-0901",
        "owner_org_id": "ORG-OWNER",
        "size_system": "US_MENS",
        "size_value": "9",
        "brand": null,
        "model": null,
        "category": "HOCKEY",
        "acquisition_date": null,
        "acquisition_source": null,
        "acquisition_cost_minor": null,
        "ownership_evidence_ref": null,
        "home_location_id": "LOC-RINK",
        "current_location_id": "LOC-RINK",
        "custodian_org_id": "ORG-OWNER",
        "availability_state": "AVAILABLE",
        "maintenance_state": "OK",
        "lifecycle_state": "ACTIVE",
        "total_rental_cycles": 0,
        "estimated_use_minutes": 0,
        "last_inventory_verified_at": null,
        "version": 4,
        "created_at": "2026-10-07T00:07:04.588024Z",
        "updated_at": "2026-10-07T00:07:04.595972Z",
        "maintenance_flags": []
      }
    },
    "error": null
  }
]
